id,document,tag,content
1739,P12_GMT20211206.odt,Moderator comment,"MODERATOR: Apologies, but since Q2 was broken the plots won't have the right index and you won't be able to compare the plots so feel free to skip this task."
1740,P12_GMT20211206.odt,System issue,"MODERATOR: Apologies, but since Q2 was broken the plots won't have the right index and you won't be able to compare the plots so feel free to skip this task. Okay, that is okay."
1742,P12_GMT20211206.odt,Additional explanation,"I think maybe a little bit more detail on how the Z-scores are evaluated here just to how the cells are colored. I think that would be quite useful. Because I get the reason for using them but just yeah, I am not sure about just using the ones that are in the table."
1743,P12_GMT20211206.odt,Simple export,"Okay, Q1 ... (The participant exports the metadata and data files)"
1744,P12_GMT20211206.odt,Navigation complex,I am looking at the FAIR data which is a RDF file and the metadata is a ttl file.
1745,P12_GMT20211206.odt,Moderator comment,MODERATOR: Could you please confirm that you got a pop out window?
1746,P12_GMT20211206.odt,Simple export,"Yeah, I can confirm that I got a pop out window to download the files."
1747,P12_GMT20211206.odt,Simple export,"You won't be able to see this probably, but I am going to check the data table and that everything is in there."
1748,P12_GMT20211206.odt,Export (meta)data useful,So it comes as a CSV file called Q1.csv and it has 17 rows of data and the various columns with dates involved. I am going to share this in a moment because I wanted to talk about the csv file I got from the download all option.
2337,P12_GMT20211206.odt,Additional explanation,"Yeah, so I would say it is good but there are some things that are not necessarily clear straight away. So again, maybe more sort of help in the tabs to help explain things, small things like the time window length and lag. These things might be clear for the use case, for people that are actually using these tools."
1750,P12_GMT20211206.odt,Additional feature suggestion,"I mean one thing would be in the home menu, to add an extra tab called you know general directions, where you could just have a diagram showing the time window length and lag with a rough schematic to tell people of what they should be doing."
1753,P12_GMT20211206.odt,Additional feature suggestion,"The Z-scores can concede the intent of their usefulness but I would wonder about the general usefulness if it is only based on the data that is on the data table. That is because, if we could imagine, you know PM2.5 is probably much higher in the summer than in the winter. If we were to take a period of two weeks over the summer, then a high PM2.5 value over those two weeks would be very different from a high value of PM2.5 during two weeks in the winter; but both would be colored red with a high Z-score. They are not really as comparable as we might think initially, so better find a better data set to compute Z-scores against."
1754,P12_GMT20211206.odt,Metadata content clear and useful,"Yeah, I did not fully grasp the data provenance and lineage bit, but I do not know much about SQL but I imagine that these are all very useful for actually keeping a hard record of the data search that was carried out and so on."
1754,P12_GMT20211206.odt,Metadata content not useful or confusing,"Yeah, I did not fully grasp the data provenance and lineage bit, but I do not know much about SQL but I imagine that these are all very useful for actually keeping a hard record of the data search that was carried out and so on."
1755,P12_GMT20211206.odt,Visualization useful,I think the heat map plot was very nice to show a general profile of the pollutant over the time since the event.
1756,P12_GMT20211206.odt,System issue,I guess the RAM is not going to be an issue when this is up and running properly so I won't say much about that.
1758,P12_GMT20211206.odt,Metadata content not useful or confusing,"So yeah, I think ... I suppose you can choose to view those things or not as I don't find them very useful myself, but you can kind of click on and off which is good (referring to the metadata displays)."
1757,P12_GMT20211206.odt,Additional feature suggestion,"So one thing that I mentioned previously is to be able to look at the patient level, to look for somebody that has two events for something, a time series of events. I think this is a bit challenging for this set up for how things are but ..."
1759,P13_GMT20211203.odt,Wording not clear,It seems good but I just cannot understand ... (The participant reads the step that was not clear again) ...
1760,P13_GMT20211203.odt,Home tab elements useful,"Oh yeah I understand now. That seems good, seems okay I think."
1762,P13_GMT20211203.odt,Home tab elements useful,"Are these links part of the second task or can I check them here? ... Okay I will check them here. So, okay methodology ... Steps to run the dashboard ... Oh the code you wrote for this, okay. Knowledge graph, let's check that ... Oh log in, I need a username and password ..."
1761,P13_GMT20211203.odt,Home tab elements useful,"Okay it seems good, as a starting is good."
1763,P13_GMT20211203.odt,Query inputs and elements useful,"Okay, go here."
1764,P13_GMT20211203.odt,Query inputs and elements useful,"Case study, example events Ireland. I can't understand the meaning of the case ... Oh okay I understand."
1765,P13_GMT20211203.odt,Query process clear,"Example events of Ireland, it means you can add different case studies in this, which is good, great."
1766,P13_GMT20211203.odt,Query inputs and elements useful,"Possible, definite, no or high probability, so we can select them separated but, can I select more than one? Oh good good."
1767,P13_GMT20211203.odt,Query inputs and elements useful,"I will just select one of them as I am curious about for example definite events, which have 149 records in this."
1768,P13_GMT20211203.odt,Query inputs and elements useful,"It is good Location, for example just in Dublin as I just know Dublin."
1769,P13_GMT20211203.odt,Query process complex,"Time window length in days ... Does this mean the length of the follow up? Oh I don't know. It is a little weird for me this part, the time window length. It could have different meanings for different researchers, you know. For example, I think this is the follow up time for every patient. For me that would be the case and I will select 4 months."
1770,P13_GMT20211203.odt,Moderator comment,MODERATOR: Could you please reduce the value to a few days as I currently have a problem with the memory for this dashboard?
1771,P13_GMT20211203.odt,System issue,"Yes, yes, no problem. I just wanted to try. I will select 5 days. No problem at all."
1772,P13_GMT20211203.odt,Query process complex,"Time window lag ... I suppose it is about the history of the patient so I will select 5 days. I am not sure about this one. For me, it refers to the history of the patient before the diagnosis."
1773,P13_GMT20211203.odt,Query process clear,"(The participant checks for available data but none is available) I think it is about these options ... Maybe I check again selecting for possible, definite, no or high probability."
1774,P13_GMT20211203.odt,Query process clear,"Okay, 3 events and 20 envo data sets available ..."
1775,P13_GMT20211203.odt,Wording not clear,What? ... Oh environmental data sets.
1776,P13_GMT20211203.odt,Query inputs and elements useful,"Temporal unit, I don't have anything to say about this, it is clear. I will choose daily."
1777,P13_GMT20211203.odt,Query inputs and elements useful,"Aggregation method, I will select the mean."
1778,P13_GMT20211203.odt,Query process clear,"Then, I submit."
1779,P13_GMT20211203.odt,Overall positive experience,I am excited to see what I get.
1780,P13_GMT20211203.odt,Task sequence complex,Okay ... (The participant reads the task again)
1781,P13_GMT20211203.odt,Metadata content clear and useful,"Well, this part seems good. It's good, it seems good and enough I think."
1782,P13_GMT20211203.odt,Metadata content clear and useful,"Okay ... (The participant reads the column headings of the data provenance table). Okay, all the events are high probability in county Dublin. Event date ... that means ... Okay, the information is summarized according to the event date."
1783,P13_GMT20211203.odt,Metadata content not useful or confusing,I can't understand the meaning of data sets used. I can't understand this part.
1785,P13_GMT20211203.odt,Metadata content clear and useful,This is telling me that the information was extracted from these data sets.
1784,P13_GMT20211203.odt,Wording not clear,"Does the event name contain the number of observations? Yeah, event-1 ... Is this the number of events or the number of cases? We have longitudinal data so these are different as we have more than one event per person, so that is different."
1786,P13_GMT20211203.odt,Metadata content clear and useful,"The time is the time for the event data, which is great for survival analysis as we need the exact time."
1787,P13_GMT20211203.odt,Wording not clear,"Again, this is the number of cases maybe. That would be great to show, the number of events for which case, the number of visits. In my language that would be the observation number for every case. Something like this would be good."
1788,P13_GMT20211203.odt,Metadata content clear and useful,Okay that is fine.
1789,P13_GMT20211203.odt,Metadata content clear and useful,I am not completely sure about the data sets but I think two groups of data are used there. I hope so.
1790,P13_GMT20211203.odt,Task sequence complex,(The participant reads the sub task again)
1791,P13_GMT20211203.odt,Task sequence complex,I cannot understand the task here. I do not have any idea about the last question 4.e.
1792,P13_GMT20211203.odt,Moderator comment,"MODERATOR: As it says in the task, you need to go to the full metadata exploration."
1793,P13_GMT20211203.odt,Navigation complex,"Oh, yes, the next part. I will go to data lineage but this is like the last part exactly. No there is something here ... What is this?"
1794,P13_GMT20211203.odt,Metadata content clear and useful,"This is about the information about the linkage of the data, which is not useful to be but it probably is for a computer scientist ... and maybe for me, because I need to link different data sets. Yes, this is good because you open all of your information. That is great if I understand it."
1796,P13_GMT20211203.odt,Task sequence complex,(The participant reads the sub task again)
1797,P13_GMT20211203.odt,Navigation complex,It's ... I am not sure if this is in the metadata exploration.
1795,P13_GMT20211203.odt,Moderator comment,MODERATOR: Do you want to read the introductory paragraph again at the top of the tab?
1798,P13_GMT20211203.odt,Task sequence complex,(The participant reads the introductory paragraph again)
1799,P13_GMT20211203.odt,Search feature simple,"I need to search with Control+F. Oh, yeah I forgot about that. I am like a fish, a red fish, just have 3 min of memory (joking). Okay so I need to search about that. Data use ... okay, there is another part here ... (The participant reads the data use comment) ... Oh fantastic! Good."
1800,P13_GMT20211203.odt,Search feature simple,"Explaining this is good, great ... So you put keywords here ... Identification risk ... Okay ... (The participant reads the identification risk comment) ... Do I need to read all of them? That's good to keep you informed about it."
1801,P13_GMT20211203.odt,Search feature simple,License ... So licenses are for rules? ... (The participant reads the license) I think this is good for research so you can open your data.
1802,P13_GMT20211203.odt,Navigation complex,"That means ... Are these the metadata buttons ... Ups ... I downloaded something, which I am not sure why. I think it is the full metadata."
1803,P13_GMT20211203.odt,Moderator comment,MODERATOR: Do you want to read the task again?
1804,P13_GMT20211203.odt,Task sequence complex,(The participant reads the task again)
1805,P13_GMT20211203.odt,Wording not clear,I think I cannot understand the meaning of 'underneath'?
1806,P13_GMT20211203.odt,Moderator comment,"MODERATOR: It means below, at the bottom."
1807,P13_GMT20211203.odt,Export (meta)data useful,"(The participant reads the column heading descriptions) For me it is clear, great, fine."
1808,P13_GMT20211203.odt,Additional feature suggestion,Can I filter or something like that? Could you include more options for that?
1809,P13_GMT20211203.odt,Navigation complex,Does this order by the maximum values? (referring to the ordering of the columns)
1811,P13_GMT20211203.odt,Task sequence complex,"Oh, how can I see PM10 again? I don't know how to find it."
1810,P13_GMT20211203.odt,Moderator comment,MODERATOR: Do you want to read the task again?
1812,P13_GMT20211203.odt,Task sequence complex,(The participant reads the sub task again)
1813,P13_GMT20211203.odt,Data table features useful,"Okay, that is great. It is like filter columns. That is great."
1814,P13_GMT20211203.odt,Additional feature suggestion,I would like for example to select PM10 in a special range.
1817,P13_GMT20211203.odt,Export (meta)data useful,For me this is useful data to analyze not to understand something. As my background and need I would need a special view about min/max view for different events.
1818,P13_GMT20211203.odt,Export (meta)data useful,It is good overall data for me as I could learn some basic descriptors of the data set.
1816,P13_GMT20211203.odt,Export (meta)data useful,"It is good, really tidy and that is good. I like this."
1815,P13_GMT20211203.odt,Additional feature suggestion,"Is there any demographic information? It would be good to include clinical, demographics and environmental information at the same time, not separately, at least for me."
1819,P13_GMT20211203.odt,Navigation complex,"Oh, what happened? Oh okay ..."
1820,P13_GMT20211203.odt,Visualization useful,"Oh that's the heat map. It has more information about it. It is a great map. I like it. The X-axis is the relative time from the event ... Okay, that's good."
1821,P13_GMT20211203.odt,Visualization useful,"I will select SO2 again. That is good. Can we see the number of the outliers? Oh yeah, great informative plots! I really like this. It is easier like this and good."
1822,P13_GMT20211203.odt,Visualization useful,"I like your plots, they are great."
1823,P13_GMT20211203.odt,Additional feature suggestion,"Do we have a total for all the events for example? Oh no, just the events separately."
1824,P13_GMT20211203.odt,Plot design complex,"I am not sure of what a polar plot is exactly ... I will try SO2. Is it a type of circular plot? Oh, okay, does the polar plot mean something like geography? I can see something more in the south here. I don't know about polar plots."
1825,P13_GMT20211203.odt,Additional feature suggestion,It would be good if you can show more than one. You know about R so you can use something like ggplot. Plots like that if you understand me.
1826,P13_GMT20211203.odt,Visualization useful,It was great. I like this part so much.
1827,P13_GMT20211203.odt,Query inputs and elements useful,(The participant inputs different input options in the query panel)
1828,P13_GMT20211203.odt,System issue,"What have I just downloaded? Well, I will remove this."
1829,P13_GMT20211203.odt,Query inputs and elements useful,"Okay, so Q1 and Q2."
1830,P13_GMT20211203.odt,Metadata content clear and useful,"I need to go to data provenance ... okay ... there are the same. Is this good? Okay. These two are the same, this part is clear."
1831,P13_GMT20211203.odt,Search feature simple,"I will check their license ... I need to go to full metadata, I remember. Is this the license for Q2? Then, the same license. Oh great I found it."
1832,P13_GMT20211203.odt,Data table features useful,"Probably the first one because it had more cases but let me check it. Yes, the first one because it had more values overall I guess."
1833,P13_GMT20211203.odt,Overall positive experience,"Yes, going to the plots is my favorite part."
1835,P13_GMT20211203.odt,Visualization useful,I will select SO2 in the heat map. That means I have only selected two values per event as it says in the relative time from the event.
1834,P13_GMT20211203.odt,Additional feature suggestion,I selected some different measures for both of these. Can I see both of them on the same page?
1836,P13_GMT20211203.odt,Visualization useful,"Relative time from the event ... I am not sure about how to interpret heat maps, I just have this and this which is different in the second one. Okay, I have compared them."
1837,P13_GMT20211203.odt,Wording not clear,"I am not sure what the aggregation method means now. Does this mean that for every variable you use the sum? Oh, okay I understand now. This is about an aggregation method, maybe it is because there is a different definition in my field."
1837,P13_GMT20211203.odt,Query process complex,"I am not sure what the aggregation method means now. Does this mean that for every variable you use the sum? Oh, okay I understand now. This is about an aggregation method, maybe it is because there is a different definition in my field."
1838,P13_GMT20211203.odt,Export (meta)data useful,We can also download them so I think it is fine.
1843,P13_GMT20211203.odt,Additional feature suggestion,"Maybe include a summary of the data table with the aggregation method and the rest. But if we can download it, I think it is fine."
1844,P13_GMT20211203.odt,Moderator comment,MODERATOR: Do you want to read the task again?
1845,P13_GMT20211203.odt,Task sequence complex,(The participant reads the task again)
1847,P13_GMT20211203.odt,Task sequence complex,Is it not working when I click?
1846,P13_GMT20211203.odt,Moderator comment,MODERATOR: You have previously blocked the downloads from this site so you need to unblock them there in the top of the browser.
1848,P13_GMT20211203.odt,Simple export,"Okay, FAIR data and metadata."
1849,P13_GMT20211203.odt,Simple export,"Oh, yeah. I have downloaded the file."
1850,P13_GMT20211203.odt,Export (meta)data useful,I will open the csv file and ... Okay this is about the data.
1851,P13_GMT20211203.odt,Navigation complex,"What is the data table? Where is this? ... There is no data table ... Oh, it is at the end of the page ... I think I clicked something that I cannot remember."
1852,P13_GMT20211203.odt,Moderator comment,MODERATOR: You can use the Control+F if it helps you find the data table.
1853,P13_GMT20211203.odt,Navigation complex,Download all data tables ... Oh my god! It was right there! right in front of me (joking).
1857,P13_GMT20211203.odt,Moderator comment,MODERATOR: Can you do 8.c also?
1856,P13_GMT20211203.odt,Simple export,"Okay, this is a zip file, good."
1840,P13_GMT20211203.odt,Additional feature suggestion,"Can I link both of the queries with each other? No, it is not so important as it will make it messy."
1855,P13_GMT20211203.odt,Export (meta)data useful,"Definitely, all of this information in this shape/format is important."
1855,P13_GMT20211203.odt,Overall positive experience,"Definitely, all of this information in this shape/format is important."
1854,P13_GMT20211203.odt,Additional feature suggestion,"But for example, the information is linked with events and date time but for me it is important to have the number of observations for every case and the exact time for every case. I also need additional demographic information like age and gender together with environmental information, which will be very great. Age and gender is usually demographic information so if you can add these demographics at least it would be great. The clinical information would be harder but I think demographics would be enough."
1841,P13_GMT20211203.odt,Overall positive experience,"Generally, if I want to summarize my idea about the dashboard I would say that it is great."
1842,P13_GMT20211203.odt,Additional feature suggestion,"It would be better to add the information I just said together with a range in the number of observations for every case. For example, not just the time."
1839,P13_GMT20211203.odt,Overall positive experience,"It is great, well done."
1858,P14_GMT20220124.odt,Moderator comment,MODERATOR: Would you mind answering the questions in the task aloud please?
1877,P14_GMT20220124.odt,Home tab elements useful,"So, I got an overall understanding."
1878,P14_GMT20220124.odt,Wording not clear,There were a few syntax errors and typos in there.
1879,P14_GMT20220124.odt,Additional feature suggestion,I don't think I would add anything besides giving an example of a potential use case. Moving from the abstract to the specific.
1879,P14_GMT20220124.odt,Additional explanation,I don't think I would add anything besides giving an example of a potential use case. Moving from the abstract to the specific.
1880,P14_GMT20220124.odt,Query inputs and elements useful,"Okay, so I've logged in already."
1881,P14_GMT20220124.odt,Event concept and approach not clear,It is not clear what those events are.
1883,P14_GMT20220124.odt,Query inputs and elements useful,"I am looking at these possible, definite, no or high probability, which implies we are talking about flare events I suspect. Event classified as definite by an agent."
1885,P14_GMT20220124.odt,Navigation complex,"It is hard to get rid of that (referring to the event pop up info box). Oh, I need to click that again."
1884,P14_GMT20220124.odt,Additional feature suggestion,"I can see that these are possible, definite, no or high probability flare events. From a researcher perspective it does not make a lot of sense to separate these out but irrespective I will choose definite and high probability. Generally, when we do research we combine these two groups."
1886,P14_GMT20220124.odt,Query inputs and elements useful,So we are going to look at the county now.
1887,P14_GMT20220124.odt,Query process complex,Time window length ... I presume that means the interval to query.
1888,P14_GMT20220124.odt,Additional feature suggestion,"I think this should be months rather than days. At least in my use case, it does not make sense to look at a day interval. But we can increase this to 44 days."
1859,P14_GMT20220124.odt,Moderator comment,MODERATOR: Would you mind selecting only a few days due to a memory problem I have with the current deployment of the dashboard?
1889,P14_GMT20220124.odt,Query inputs and elements useful,"Time window lag ... This is presumably looking at introducing a lag period of X amount of days. For a flare event, we might want to look at 10 days."
1890,P14_GMT20220124.odt,Wording not clear,"Events and envo data sets, envo I guess it means environmental. This is not exactly clear, I would use the term environmental there."
1891,P14_GMT20220124.odt,Query process clear,So there are 19 events and 4 data sets being buried.
1892,P14_GMT20220124.odt,Query inputs and elements useful,(The participant reads the temporal unit tool tip) I will pick days.
1894,P14_GMT20220124.odt,Additional feature suggestion,We are asked to choose an aggregation method but of course the aggregation method depends on the variable under discussion. It will differ if we are talking about rainfall or whatever. I don't think you can apply an aggregation method to the overall data set.
1893,P14_GMT20220124.odt,Additional feature suggestion,"For the purposes of this we will choose min/max, this should be min and max. There is no rationale to choose min or max separately. These two should be combined."
1895,P14_GMT20220124.odt,Wording not clear,"Particularly, I would use the term environmental instead of envo."
1896,P14_GMT20220124.odt,Event concept and approach not clear,I would add what is an event and what the event types mean. These were not very clear.
1896,P14_GMT20220124.odt,Additional explanation,I would add what is an event and what the event types mean. These were not very clear.
1897,P14_GMT20220124.odt,Wording not clear,"Comprehend is a poor word there. Yeah, so this sentence needs to be rewritten as I don't really know what it means."
1898,P14_GMT20220124.odt,Additional feature suggestion,"Maybe you can put a little information box to explain the meaning of data provenance and lineage. Perhaps, just put one beside each of these buttons to provide a bit more information. Particularly, these two on the left."
1899,P14_GMT20220124.odt,Wording not clear,"So data table, I would separate those terms into data and table, not data table."
1900,P14_GMT20220124.odt,Additional explanation,So how do we know if data is normally distributed? Are we supposed to know this before we start? The assumption is that we know whether it is normally distributed. You might need something there to advise people about that.
1901,P14_GMT20220124.odt,Wording not clear,DateT I don't know what the T means ...
1860,P14_GMT20220124.odt,Moderator comment,"MODERATOR: Before exploring the data table, do you mind completing task 4 please?"
1902,P14_GMT20220124.odt,Wording not clear,"So, again for usability all of these are in variable names in a database. Perhaps, these can have a more readable data label."
1903,P14_GMT20220124.odt,Wording not clear,"I don't know what eg: means here, it implies you are providing an example of something. I presume each row represents an event, so if you would take out the eg: it would make sense."
1904,P14_GMT20220124.odt,Metadata content not useful or confusing,The numbers in the events are not clear what they represent ... Are they use case IDs? ... It is not clear what the number means but maybe it is not important.
1907,P14_GMT20220124.odt,Metadata content clear and useful,"So we have 6 events here, it says that we have 19 here though ... Oh sorry, you can scroll down to the other events."
