id,document,tag,content
903,P5_GMT20211125.odt,Export (meta)data useful,"For me personally, the way I would use the data as I don't have experience in using RDF myself, the thing I would be looking for is the data table."
904,P5_GMT20211125.odt,Export (meta)data useful,"Then, the other information, frankly, I would like to talk to you guys about what is considered best practices but potentially it will be helpful to have it saved somewhere, in case I need it for my records or something like that. But is it something that I would directly check myself and say oh I need to check this, that is not something I would use. But that is not to say that is not important. I appreciate that it could be quite important. Especially in a collaborative project you know. In this kind of EU project we participate to keep track of what we are doing so I can appreciate the importance from that point of view. But I don't see how I would use it directly."
905,P5_GMT20211125.odt,Overall positive experience,I think the short answer is that it is a pretty positive experience.
906,P5_GMT20211125.odt,Query inputs and elements useful,Certainly logging in was very straightforward.
907,P5_GMT20211125.odt,System issue,"Establishing the queries was, you know, a little bit unstable right now but I don't know if it is because somebody is using it at the same time."
908,P5_GMT20211125.odt,Overall positive experience,I think the information was quite clear.
909,P5_GMT20211125.odt,Query inputs and elements useful,I like the fact that you can use multiple tabs for multiple queries.
910,P5_GMT20211125.odt,Export (meta)data useful,"I feel as if the emphasis of the dashboard is in getting the data you are interested in but also to provide information about metadata and RDF. Probably, this is kind of important because it is the kind of thing that I would for me, how you actually resource that data I don't really know about that. So the fact that there is some background information that lets you think about what is involved is quite helpful to check what is going on there. So that could be useful."
2327,P5_GMT20211125.odt,Visualization useful,I think the plots that are there are useful
2328,P5_GMT20211125.odt,Export (meta)data useful,but I don't know how much further you want to go with them as I can download the data and do it myself.
2329,P5_GMT20211125.odt,Visualization useful,"But it is useful to have a look before you get all excited about all this data, and you say hang on, I need to resubmit the query. It is useful to have a little bit to see what is going on. I don't think you need to go in depth too much there."
912,P6_GMT20211126.odt,Query inputs and elements useful,"I am putting my username and password to sign in, okay."
913,P6_GMT20211126.odt,Home tab elements useful,"So events with locations and time, environmental data, individual environmental records, okay."
916,P6_GMT20211126.odt,Wording not clear,"Not now, I need to read it again I suppose."
914,P6_GMT20211126.odt,Additional feature suggestion,"Maybe an example, a pure example of how it works."
915,P6_GMT20211126.odt,Query inputs and elements useful,"Okay, I did it"
917,P6_GMT20211126.odt,Query inputs and elements useful,"So as a case study I have to select an example of Ireland events. Eh ... possible, definite, no, high probability. High probability. Location: Cork. Time window from day 1 to eh 15 days."
918,P6_GMT20211126.odt,Wording not clear,"Click to check data availability. Envo data available, I don’t know what envo is."
919,P6_GMT20211126.odt,Query process clear,"Well, I think I used 15 days because for a rare disease event we need at least 1 week of exposure, that is why I used 15 days."
920,P6_GMT20211126.odt,Event concept and approach not clear,"Yes, well, The high probability I do not exactly understand what it means. If the event is high probable, I suppose that's the meaning."
921,P6_GMT20211126.odt,Query inputs and elements useful,"Okay I did it, Oh no I did not. I need to fill a temporal unit: hour, day, month or year. So I will click on the day because I chose 15 days."
922,P6_GMT20211126.odt,Query inputs and elements useful,"Aggregation method: mean, sum, min or max. I will use the mean as I suppose is better and then I will click on submit."
923,P6_GMT20211126.odt,Task sequence complex,"Ehm so the introductory paragraph, we have a data table ... (The participant reads the data table text below.)"
924,P6_GMT20211126.odt,Export (meta)data useful,"So I have the first column with I suppose is the 15 days, yeah. Event, the event-540, and the high probability events anonymised. Then, the exposures of particles of 1um? Yeah I can read it here: particulate matter <10um. Then, the participant reads the rest of the column names ..."
925,P6_GMT20211126.odt,Export (meta)data useful,"So for this event, I have this ... I have to understand the table ... So for this event, this was the mean temperature of the 15 days ... Yeah, now I understand. So for this event, there was this temperature, pressure, mean sea level pressure precipitation on the 15 preceding days to the event. For this event, etcetera etcetera."
927,P6_GMT20211126.odt,Task sequence complex,"How many events were there? Can I see that? Ah no you have it there, many more events. Do I know how many events? Because I have 2 tables but I cannot count the number of events. So okay, I will go back to reading the tasks."
926,P6_GMT20211126.odt,Navigation complex,Is Q1 this one?
928,P6_GMT20211126.odt,Moderator comment,MODERATOR: I think it is because of your zoom setting in the browser so if you scroll up or decrease the zoom you will be able to see the heading of the interface.
929,P6_GMT20211126.odt,Task sequence complex,Three buttons below? Which are the three buttons below? Is it here? Because I have 4.
929,P6_GMT20211126.odt,Navigation complex,Three buttons below? Which are the three buttons below? Is it here? Because I have 4.
930,P6_GMT20211126.odt,Task sequence complex,(The participant reads the tasks again)
931,P6_GMT20211126.odt,Metadata content clear and useful,"Data comes from events in Ireland. The events are here as examples in the table, event-118. So I can go back to the table and check if it corresponds ... but how can I get back? Ah it's here."
931,P6_GMT20211126.odt,Navigation complex,"Data comes from events in Ireland. The events are here as examples in the table, event-118. So I can go back to the table and check if it corresponds ... but how can I get back? Ah it's here."
932,P6_GMT20211126.odt,Metadata content clear and useful,"For example event-118, I want to see the data table ... 118 where is it? Oh it's here. So this one is a high probability event from Cork, the county of Cork. It was on this event date."
933,P6_GMT20211126.odt,Metadata content not useful or confusing,The data sets used ... I do not understand this data set ...
934,P6_GMT20211126.odt,Metadata content clear and useful,"The other events you put an example of where they come from, that's what I understand"
935,P6_GMT20211126.odt,Navigation complex,"So data lineage, what's the difference with data provenance? Sorry I ... Oh ah, it's different."
936,P6_GMT20211126.odt,Metadata content not useful or confusing,"So, yeah that I cannot understand ... Data lineage, I suppose, is the script you used to get the data."
937,P6_GMT20211126.odt,Metadata content not useful or confusing,Eh ... (The participant does not explore this text correctly)
938,P6_GMT20211126.odt,Task sequence complex,(the participant reads a few times the task)
939,P6_GMT20211126.odt,Metadata content clear and useful,"So to check how many data sets were used I need to count here: 1, 2, 3, 4, 5, 6, 7, 8, 9 ... so you used 9 data sets, is that right?"
940,P6_GMT20211126.odt,Task sequence complex,(The participant reads the task again)
941,P6_GMT20211126.odt,Search information process complex,"I am searching for identification risk ... I cannot find it. So I have to go to full metadata text and here I have to identify data use here. Identification risk, no I do not know where I need to go to find the identification risk."
942,P6_GMT20211126.odt,Moderator comment,MODERATOR: Do you want to read the introductory paragraph again?
946,P6_GMT20211126.odt,Search information process complex,"(The participant reads the introductory paragraph again). So I have to search for the risk in the full metadata text. Oh okay. Control + F, and ... I need to click on control + F"
944,P6_GMT20211126.odt,Moderator comment,MODERATOR: it may be command + F in your computer
947,P6_GMT20211126.odt,Search information process complex,"Oh yeah, now yes. I have to search identification risk ... let me see (the participant reads again the introductory paragraph) So control + F identification ... Ah here, there's the information."
949,P6_GMT20211126.odt,Search information process complex,"(the participant identifies the elements from the task) Yeah, you put the information about the identification risk I'm not sure if I understood ... (The participant reads the task again)"
948,P6_GMT20211126.odt,Search feature simple,"Yeah, I can write in license ... (the participant identifies the elements from the task)"
950,P6_GMT20211126.odt,Navigation complex,That is what I did before ... Case study ... Oh no it was here
951,P6_GMT20211126.odt,Data table features useful,Yes
952,P6_GMT20211126.odt,Data table features useful,"Yeah, I click here and it's okay"
953,P6_GMT20211126.odt,Export (meta)data useful,"So again, I have these events and I can know if these were exposed to particulate matter for 15 days before the event, that’s what I understand. What was the mean temperature 15 days before the event. The different variables 15 days before the event, etcetera. That is what I understand."
954,P6_GMT20211126.odt,Task sequence complex,(The participant reads the task again)
955,P6_GMT20211126.odt,Data table features useful,For now I do not have any ideas
957,P6_GMT20211126.odt,System issue,when I click on PM10 I might need to see elsewhere the results MODERATOR: maybe try another one Oh Okay maybe there's no data for it Oh yeah it works for rain.
956,P6_GMT20211126.odt,Moderator comment,MODERATOR: maybe try another one
958,P6_GMT20211126.odt,Plot design complex,"15 days before these events, the precipitation amount 15 days before ... Relative time from the event -2 ... event ... here there are the number of the events Here relative time from the event -1 ... it's from the Z-score I suppose ... the results 15 days before quantified in a Z-score for all the events Relative time from the event I don't understand that so, relative time -2 days ... the event would be in 0, you have -0.5."
959,P6_GMT20211126.odt,Visualization useful,"Again PM10, okay. So for this event, the PM10 was here and the event was exposed to more than 15ug/m3. Okay, it is the mean exposure of PM10 15 days before the event. For all the events I think now I understand the box plots for each event."
961,P6_GMT20211126.odt,System issue,I can choose PM10 ... Mmmm ... and where are the events in this polar plot?
960,P6_GMT20211126.odt,Moderator comment,MODERATOR: maybe try another variable
962,P6_GMT20211126.odt,Plot design complex,"Okay, this is the mean for ozone, but where are the events in this figure? I am trying to understand this figure: east, west, north, south ... The mean ozone in this time window in the area it was chosen. The mean of ozone 15 preceding the events but which events ... or just in the area chosen ... the whole ozone concentration in a geographic manner I suppose that's the result."
963,P6_GMT20211126.odt,Query inputs and elements useful,"Okay, so now I have to go back. I was in Ireland and now I will choose another country. Oh, I cannot choose another country but I can use definite instead of high probability. Then I can keep the one before ... location I will change from Cork to Dublin."
964,P6_GMT20211126.odt,Query inputs and elements useful,"Well, I will keep them both."
965,P6_GMT20211126.odt,Query inputs and elements useful,"Time window, I will choose more time. Maybe here in the time window if you want to be larger than days maybe you can add something more to be quicker than adding days one by one. Oh no you can do like this and write the input yourself."
966,P6_GMT20211126.odt,Query process clear,"Okay so Q2 is because Q1 was the first thing I searched and then Q2 is the second query, yeah."
967,P6_GMT20211126.odt,Metadata content clear and useful,"Okay, so to know how many data sets were used for Q1 I need to go to the data provenance. For example here, I have the number of data sets for this query: 1, 2, 3, 4, 5, 6, 7, 8, 9 ... and for this other query ... data provenance 1, 2, 3, 4, 5, 6, 7, 8, 9. Both have the same number of data sets ad that is because I did not change the query much. I do not know if we have the same events though. I will search for event-102 ... I do not have the same events. I think you have the same numbers of data sets for Q1 and Q2"
968,P6_GMT20211126.odt,Search information process complex,"For Q1 the license, where was it? I have to go to Full metadata exploration. Then, I have to go and check for the license again ... I cannot find the license ... It does not work when."
969,P6_GMT20211126.odt,Moderator comment,"MODERATOR: try maybe closing the Control + F window on the top, opening it again and click on the arrows"
971,P6_GMT20211126.odt,Navigation complex,I try again but there is more information than when I clicked before.
972,P6_GMT20211126.odt,Navigation complex,"Okay, now it works. I will close and open the window again."
973,P6_GMT20211126.odt,Search feature simple,"Here there's the license for Q1, creative commons. For Q2, yeah it's here. I do not remember exactly the end of the creative commons link but I suppose they are the same"
976,P6_GMT20211126.odt,Navigation complex,"I did not check for all the columns in the table. I cannot seem to go further, maybe it's the end of the table."
977,P6_GMT20211126.odt,Data table features useful,"There are a lot of colors in Q2 and in the Q1 again, yeah there are maybe less colors."
974,P6_GMT20211126.odt,Navigation complex,Oh no I have to check page 1 and page 2 of the table.
975,P6_GMT20211126.odt,Data table features useful,"No I was wrong, I think both have similar number of colored cells. But yeah, I suppose it is about the same because one has less numbers but I would have to check it correctly. In a first view, I suppose they are the same."
978,P6_GMT20211126.odt,Visualization useful,"Better box plot ... in Q1 I have a box plot with 8 events that were exposed to less than 25 ug/m3 of PM10. So that was for the first query, and for the second query ... I have to select PM10 again, yeah. So I have 8 events and the PM10 exposure distribution is less skewed compared to Q1. Oh no, because the mean is 18 and here 25 son the distribution is similar."
980,P6_GMT20211126.odt,Task sequence complex,So I go to the first query and I have to export all ...
979,P6_GMT20211126.odt,Task sequence complex,(The participant reads the task again)
981,P6_GMT20211126.odt,Simple export,"Okay, so here I can download the FAIR metadata export and here the FAIR data export"
982,P6_GMT20211126.odt,Navigation complex,"Data provenance ... I want to export it as CSV ... so how can I do it? Sorry, I am looking for where I can download this information."
983,P6_GMT20211126.odt,Moderator comment,MODERATOR: maybe click again the button data provenance
984,P6_GMT20211126.odt,Navigation complex,"Oh yeah, export ... csv"
985,P6_GMT20211126.odt,Simple export,Okay
986,P6_GMT20211126.odt,Export (meta)data useful,"Yeah, I think it is usable and reusable, because you can search again for the same information."
987,P6_GMT20211126.odt,Additional feature suggestion,I think you have to be concentrated in all the information you provide while thinking aloud ... maybe if there is less information it would be more understandable but at the same time you need all this information at one point. So maybe you can click on a button to click the whole information and at the first stage maybe you do not need all the information at once. That is my idea at this point.
970,P6_GMT20211126.odt,Overall positive experience,But the experience was okay.
993,P7_GMT20211126.odt,Home tab elements useful,"Okay, this is very clear I think."
994,P7_GMT20211126.odt,Home tab elements useful,"Yes, I think it is pretty clear. You describe the things you can do with the framework and the different options that you have"
995,P7_GMT20211126.odt,Query inputs and elements useful,"Okay, so here I have the credentials from the email. I'm going to log in. Okay I am already logged in."
996,P7_GMT20211126.odt,Query inputs and elements useful,The events ... I'm going to choose possible events
997,P7_GMT20211126.odt,Query inputs and elements useful,I'm going to select Dublin because I think it can be the most interesting.
998,P7_GMT20211126.odt,Query inputs and elements useful,"Time window in days ... let's try 4 months maybe or 20 days, and the lag 1 week."
999,P7_GMT20211126.odt,Query process clear,"Let's check, maybe if I change this because there are no events."
1000,P7_GMT20211126.odt,Query process clear,Oh okay now I have 2 events and 20 data sets.
1001,P7_GMT20211126.odt,Query inputs and elements useful,Temporal units about days
1002,P7_GMT20211126.odt,Query inputs and elements useful,the aggregation method the mean
1003,P7_GMT20211126.odt,System issue,"MODERATOR: Could you please select less days? Because it is an example data base and it would take a long time Okay, 30 days is okay? MODERATOR: Sure, no problem"
1005,P7_GMT20211126.odt,Moderator comment,MODERATOR: Could you please select less days?
1004,P7_GMT20211126.odt,Moderator comment,"MODERATOR: Sure, no problem"
1006,P7_GMT20211126.odt,Query inputs and elements useful,"Okay, I think everything here is very clear."
1007,P7_GMT20211126.odt,Query inputs and elements useful,I would not add any extra information because the interface here to get the data is quite clear and the message is very clear.
1007,P7_GMT20211126.odt,Query process clear,I would not add any extra information because the interface here to get the data is quite clear and the message is very clear.
1008,P7_GMT20211126.odt,Task sequence complex,"Okay, let's go by parts."
1009,P7_GMT20211126.odt,Metadata content clear and useful,"Okay, the information provided here is quite clear."
1010,P7_GMT20211126.odt,Metadata content clear and useful,"Okay, the case study is this, the events are high probability, the county is Dublin, and the last column I assume is the list of the 20 data sets used in the query."
1011,P7_GMT20211126.odt,Metadata content not useful or confusing,Here we just have more information
1012,P7_GMT20211126.odt,Metadata content not useful or confusing,(The participant does not explore this information)
1013,P7_GMT20211126.odt,Metadata content clear and useful,"Yes, around 20 for each one."
1014,P7_GMT20211126.odt,Search feature simple,"Okay, so I can use control+F to search the information in the metadata text."
1015,P7_GMT20211126.odt,Search feature simple,Data use comment - Clear information
1016,P7_GMT20211126.odt,Search feature simple,"Identification risk comment - Let's see, I think here there's information regarding on how the data set was made in terms of confidential information and so on. I think it is also clear."
1017,P7_GMT20211126.odt,Search feature simple,"License - The license is creative commons, okay. If you need more information about creative commons you can go directly to the web page of the license type."
1018,P7_GMT20211126.odt,Export (meta)data useful,Here if you put the cursor on top of the column heading you can see a brief description of the particular column ... (The participant reads the data table column heading names and descriptions.)
1019,P7_GMT20211126.odt,Data table features useful,"Yeah, I can understand the colors because here it says the meaning of each color. The high values are read and the low values are blue."
1020,P7_GMT20211126.odt,Data table features useful,"Okay, let's see. Yes, it can be hidden, perfect."
1021,P7_GMT20211126.odt,Export (meta)data useful,"The information provided is useful for a particular study, you have a good temporal resolution, description and it is quite easy to see the values."
1022,P7_GMT20211126.odt,Data table features useful,I would not add any kind of extra information in the description and the colors are clear.
1022,P7_GMT20211126.odt,Export (meta)data useful,I would not add any kind of extra information in the description and the colors are clear.
1023,P7_GMT20211126.odt,Data table features useful,This feature of hiding the columns with the eye icon is also easy to use.
1024,P7_GMT20211126.odt,Visualization useful,"I think it is quite clear as you can see all the information in the box plot (median, max, min ...). It is very intuitive."
1025,P7_GMT20211126.odt,Visualization useful,"I think the map is very clear as it provides information when you put your cursor over the plots. We could try with another variable but I assume it's the same. Let's try rain, we can see the precipitation amount per day."
1026,P7_GMT20211126.odt,Visualization useful,The plots are fine
1027,P7_GMT20211126.odt,Visualization useful,They are useful and pretty but also provide the numerical information with just hovering the cursor over the graph.
1029,P7_GMT20211126.odt,Query inputs and elements useful,Okay so let's first input another query. Let's try with the same one but definite in the same place. Let's try this.
1028,P7_GMT20211126.odt,Query process clear,"Oh so okay, two events."
1030,P7_GMT20211126.odt,Query process clear,Now we have a Q2 and the previous work was saved as Q1.
1032,P7_GMT20211126.odt,Query inputs and elements useful,Now we have a Q2 and the previous work was saved as Q1.
1031,P7_GMT20211126.odt,Task sequence complex,(The participant reads the task again)
1033,P7_GMT20211126.odt,Metadata content clear and useful,"Okay, so the first one because it has 20 data sets this one is just 2 data sets. This is clear."
1034,P7_GMT20211126.odt,Search feature simple,The last one was creative commons and let's see this one ... Yeah same license.
1036,P7_GMT20211126.odt,Navigation complex,"I think this one, oh no the first one. Let's bring back the columns I hid before ... I do not know what I did but ... oh okay I see."
1035,P7_GMT20211126.odt,Data table features useful,I think the first data set has more extreme values because it has more colored backgrounds.
1040,P7_GMT20211126.odt,Visualization useful,"Q1 box plot rain and Q2 box plot the same, rain."
1039,P7_GMT20211126.odt,Task sequence complex,Let's see ... Which was the question I can't remember?
1037,P7_GMT20211126.odt,Task sequence complex,(The participants reads the task again)
1038,P7_GMT20211126.odt,Data table features useful,I would not add anything because the results are quite clear because when you select a new case study it automatically generates a new Q here that you can compare by clicking one tab and another. I think it is very transparent so it is fine for me.
1038,P7_GMT20211126.odt,Visualization useful,I would not add anything because the results are quite clear because when you select a new case study it automatically generates a new Q here that you can compare by clicking one tab and another. I think it is very transparent so it is fine for me.
1038,P7_GMT20211126.odt,Query inputs and elements useful,I would not add anything because the results are quite clear because when you select a new case study it automatically generates a new Q here that you can compare by clicking one tab and another. I think it is very transparent so it is fine for me.
1038,P7_GMT20211126.odt,Query process clear,I would not add anything because the results are quite clear because when you select a new case study it automatically generates a new Q here that you can compare by clicking one tab and another. I think it is very transparent so it is fine for me.
1041,P7_GMT20211126.odt,Simple export,"Okay, I think I have downloaded that."
1042,P7_GMT20211126.odt,Moderator comment,MODERATOR: it is fine if you don't want to save it. It is just to see if you can download the file.
1043,P7_GMT20211126.odt,Simple export,Okay I could save data and metadata
1044,P7_GMT20211126.odt,Simple export,"Okay, okay ... I will click here and save this again ..."
1045,P7_GMT20211126.odt,Simple export,MODERATOR: Do you mind doing task 8.b please?
1046,P7_GMT20211126.odt,Navigation complex,"So Data provenance and Data table as CSV files Oh yeah yeah, I had forgotten the export button here. Okay, now I have the CSV here."
1047,P7_GMT20211126.odt,Simple export,"Oh I couldn't see that ... Oh, when you download the data you get a zip file with the data table for the two queries. Okay, I think this is very useful. Thanks for reminding me of that."
1047,P7_GMT20211126.odt,Export (meta)data useful,"Oh I couldn't see that ... Oh, when you download the data you get a zip file with the data table for the two queries. Okay, I think this is very useful. Thanks for reminding me of that."
1048,P7_GMT20211126.odt,Export (meta)data useful,I think the raw data from the CSV is useful by itself. I mean if you are searching for some environmental data for experiments the normal file format you find is CSV because it is useful for many programming languages.
1049,P7_GMT20211126.odt,Export (meta)data useful,"The metadata is also useful because you have a brief description for the data you are downloading about the data itself, the legal things and so on."
1050,P7_GMT20211126.odt,Export (meta)data useful,"So yeah, I think all of the files are very useful."
