id,document,tag,content
1342,P9_GMT20211129.odt,Metadata content not useful or confusing,"It looks like three, possibly yeah."
1343,P9_GMT20211129.odt,Task sequence complex,What?
1344,P9_GMT20211129.odt,Task sequence complex,(The participant reads the task again)
1345,P9_GMT20211129.odt,Search feature simple,"Okay yeah, the data can only be used to ... (the participant reads the data use comment) Okay so now identification risk ... (the participant reads the identification risk comment) Yeah, so I can find them."
1346,P9_GMT20211129.odt,Metadata content not useful or confusing,"I don't know, normally I just download the data set, open the file with whatever, use a dump command that downloads a NetCDF file, and I tend to read there the information I need. But also I do not use medical data, I use climate model data so I understand that here you have to put more ... Yeah I never had to put in the identification risk in my data ..."
1348,P9_GMT20211129.odt,Metadata content not useful or confusing,This is a bit different from what I usually do.
1347,P9_GMT20211129.odt,Search feature simple,"Okay, so creative commons license. Okay, it was possible for me to find this."
1349,P9_GMT20211129.odt,Export (meta)data useful,"(The participant starts reading all the column heading descriptions) Yeah, that's fine"
1350,P9_GMT20211129.odt,Task sequence complex,"Do you mean like a green, that there is no data?"
1351,P9_GMT20211129.odt,Moderator comment,"MODERATOR: in your case you didn't get many background colors, so don't worry about this."
1353,P9_GMT20211129.odt,Data table features useful,"Yeah, I can."
1354,P9_GMT20211129.odt,Navigation complex,"What did I do now? Oh yeah, I changed the order."
1355,P9_GMT20211129.odt,Export (meta)data useful,"Yeah, the table yeah. The table is fine I think."
1356,P9_GMT20211129.odt,Navigation complex,"The arrows let you sort the columns, yeah?"
1357,P9_GMT20211129.odt,Export (meta)data useful,I think the table is fine.
1358,P9_GMT20211129.odt,Additional feature suggestion,"I don't know if for the previous one (refers to full metadata exploration) you needed all that text. But for the metadata I don't know if there was some ... if you think we have to search for those things or whether there is one document that has them would have been more simple. But anyway, I don't know because I don't use these things in my data, so it is completely new to me."
1359,P9_GMT20211129.odt,Export (meta)data useful,When it comes to climate data and the table it was perfectly fine.
1360,P9_GMT20211129.odt,Export (meta)data useful,"No, the table is fine"
1361,P9_GMT20211129.odt,Plot design complex,Let's select the wet bulb temperature. How am I going to select it? Do I select only one field or what? Maybe I need your help here.
1361,P9_GMT20211129.odt,Navigation complex,Let's select the wet bulb temperature. How am I going to select it? Do I select only one field or what? Maybe I need your help here.
1362,P9_GMT20211129.odt,Task sequence complex,(The participant reads the task again)
1363,P9_GMT20211129.odt,Moderator comment,"MODERATOR: Next to the data table tab, there are the plots. You can also hide the full metadata text exploration by clicking the button so it does not bother you there."
1365,P9_GMT20211129.odt,Navigation complex,"Sorry, I did not get it."
1364,P9_GMT20211129.odt,Moderator comment,"MODERATOR: If you click again the full metadata text exploration button, you will get a cleaner view of the dashboard. Then, you can click on the heat map and go ahead."
1366,P9_GMT20211129.odt,Plot design complex,"Oh sorry, select like that. I thought I would be selecting it first from the table."
1366,P9_GMT20211129.odt,Navigation complex,"Oh sorry, select like that. I thought I would be selecting it first from the table."
1367,P9_GMT20211129.odt,Task sequence complex,"Okay, it didn't say in your text to go first to the heat map tab ... it says explore the heat map ... so maybe you can edit that."
1369,P9_GMT20211129.odt,Plot design complex,"I don't know what it would be ... Yeah, this measure of relative time from the event ..."
1368,P9_GMT20211129.odt,Moderator comment,"MODERATOR: The issue is that you only have one day per event, so it is just one value."
1374,P9_GMT20211129.odt,Plot design complex,"Oh, so maybe it doesn't seem too sensible."
1373,P9_GMT20211129.odt,Plot design complex,What was this meant to be if I had more events?
1370,P9_GMT20211129.odt,System issue,"Is this -1 year or what's the time unit here? MODERATOR: I just saw that it is not displayed correctly, so thanks for spotting this out. I need to change that. Also, if you have more days, you would get more values. Now you have only a value because you selected 7 days and the time unit of months, so it collapses everything to one value. Okay so let's change this to day as it will make more sense. (the participant submits another query) Okay this is better."
1371,P9_GMT20211129.odt,Moderator comment,"MODERATOR: I just saw that it is not displayed correctly, so thanks for spotting this out. I need to change that. Also, if you have more days, you would get more values. Now you have only a value because you selected 7 days and the time unit of months, so it collapses everything to one value."
1372,P9_GMT20211129.odt,Plot design complex,"I still have some doubts. I don't understand what this plot is showing ... relative time from the event with the units of minus, so I don't get it."
1375,P9_GMT20211129.odt,Event concept and approach not clear,When did this event-130 happen?
1376,P9_GMT20211129.odt,Moderator comment,MODERATOR: you can check that in the data provenance table
1378,P9_GMT20211129.odt,Plot design complex,"Okay so event-130, there are 8 inputs for event-130 so each of my ... oh seven inputs, wait 8 ... I don't know why there are 8 inputs for one event."
1377,P9_GMT20211129.odt,Moderator comment,"MODERATOR: No problem, let's move on and I will note down that it is not clear."
1379,P9_GMT20211129.odt,Wording not clear,"Then, I have no idea what this 'relative time from the event' means."
1379,P9_GMT20211129.odt,Plot design complex,"Then, I have no idea what this 'relative time from the event' means."
1380,P9_GMT20211129.odt,Visualization useful,"Okay, so box plot ... okay. Where the 8 points are 8 measurements, okay."
1383,P9_GMT20211129.odt,Plot design complex,"Man, what the heck is this? This is just something I have never seen before. This is probably ... this is somehow spatial and something ... what the heck? Why is there wind speed if I selected dew point temperature?"
1381,P9_GMT20211129.odt,Moderator comment,"MODERATOR: Apologies, what did you say?"
1384,P9_GMT20211129.odt,Plot design complex,Why does this figure display wind speed in the middle?
1382,P9_GMT20211129.odt,Moderator comment,MODERATOR: I will explain that later. If it is not clear just mention that.
1385,P9_GMT20211129.odt,Plot design complex,Maybe it is just something done in a community ...
1386,P9_GMT20211129.odt,Visualization useful,"Okay, so ... The heat maps are clear as I have seen them before. Except for the fact that to me it was confusing the time in the x axis in negative values. Perhaps it is normal in some communities but to me it was not normal."
1386,P9_GMT20211129.odt,Plot design complex,"Okay, so ... The heat maps are clear as I have seen them before. Except for the fact that to me it was confusing the time in the x axis in negative values. Perhaps it is normal in some communities but to me it was not normal."
1387,P9_GMT20211129.odt,Visualization useful,"The box plot was totally obvious, yeah. The box plot is fine."
1388,P9_GMT20211129.odt,Plot design complex,"The polar plot is not something I have seen before, so I don't know what the meaning is ... the wind speed and these circles ... I don't know what I am seeing here."
1389,P9_GMT20211129.odt,Additional explanation,"Maybe not adding more visualizations, just more explanations: what this plot presents, what's the exact x and y axis and yeah."
1390,P9_GMT20211129.odt,Query process clear,"My Q1 was a bad choice because I have selected 7 days in a monthly output, so that was quite a mess."
1391,P9_GMT20211129.odt,Navigation complex,How did you say I can close this?
1392,P9_GMT20211129.odt,Moderator comment,"MODERATOR: clicking again, yeah."
1393,P9_GMT20211129.odt,Task sequence complex,(The participant reads the task again)
1394,P9_GMT20211129.odt,Metadata content clear and useful,They all seem to use three.
1395,P9_GMT20211129.odt,Search feature simple,Creative commons ... and this one ... yeah both have the same license
1398,P9_GMT20211129.odt,Navigation complex,I did not find them in my case ...
1396,P9_GMT20211129.odt,Navigation complex,How do I know which window is this one? I would like to close that window
1397,P9_GMT20211129.odt,Moderator comment,"MODERATOR: This is the second one, data lineage."
1399,P9_GMT20211129.odt,Additional explanation,Maybe that would help. To know which one is which because I get confused on how to close them.
1400,P9_GMT20211129.odt,Data table features useful,Oh yeah the extreme events ... Q1 in my case has nothing so Q2 looks like it has more extreme events for example for rain.
1401,P9_GMT20211129.odt,Query process clear,"I mean because my ... Let's see how Q1 looks like, can it even make a box plot? Yeah okay, this was not a sensible choice."
1403,P9_GMT20211129.odt,Additional feature suggestion,"I don't know if it would be easy for you. Because you need to select the aggregation method separately, you either choose mean or maximum and minimum. Sometimes it is interesting to be able to plot mean maximum and minimum together, but I don't know how simple this is ... not every suggestion is always useful if it requires too much work. So yeah, maybe something like that. But I mean, it's okay how this is done, you can always change if you want minimum or maximum."
1404,P9_GMT20211129.odt,Simple export,"Okay so let's see, I am supposed to export FAIR data and metadata ... okay."
1405,P9_GMT20211129.odt,Simple export,"Okay, export. That looks nice."
1405,P9_GMT20211129.odt,Export (meta)data useful,"Okay, export. That looks nice."
1406,P9_GMT20211129.odt,Simple export,"Also data table, export. Oh yeah, that looks very pretty."
1406,P9_GMT20211129.odt,Export (meta)data useful,"Also data table, export. Oh yeah, that looks very pretty."
1407,P9_GMT20211129.odt,Navigation complex,Oh I don't see the download all ... oh here.
1408,P9_GMT20211129.odt,Simple export,"Okay download, perfect. Okay well."
1408,P9_GMT20211129.odt,Export (meta)data useful,"Okay download, perfect. Okay well."
1409,P9_GMT20211129.odt,Export (meta)data useful,Yeah the tables are very pretty and the graphs are very nice.
1409,P9_GMT20211129.odt,Visualization useful,Yeah the tables are very pretty and the graphs are very nice.
1412,P9_GMT20211129.odt,Overall positive experience,"Okay, well you know, I think this is growing more in me as we went through, yeah."
1413,P9_GMT20211129.odt,Event concept and approach not clear,My biggest obstacle is that I don't know what I was doing at the start and then I was expecting climate data that I am used to.
1414,P9_GMT20211129.odt,Event concept and approach not clear,It took me a while to comprehend what we were doing. Now that I kind of understand the origin of your data and purpose.
1415,P9_GMT20211129.odt,Additional feature suggestion,Yeah I don't know. Maybe if you selected 8 measurements I would write something like the measurements or number of ensemble members. Write what they really are but like it is actually quite neat.
1411,P9_GMT20211129.odt,Visualization useful,You can already create a really nice figure. Are the people using this dashboard allowed to use this figure in their publication? Yeah that's really neat.
1416,P9_GMT20211129.odt,Search feature simple,"Yeah and then it is fine. Okay I've been getting this information from your sheet. I guess yeah they will be able to find data use and identification risk because it is written up here, above the metadata options."
1410,P9_GMT20211129.odt,Overall positive experience,"So yeah well done, I think you did well."
1418,P10_GMT20211130.odt,Task sequence complex,"Home tab information, that's where I start yeah?"
1417,P10_GMT20211130.odt,Moderator comment,MODERATOR: Yes
1419,P10_GMT20211130.odt,Home tab elements useful,"Okay, yeah. I already knew what I was doing but it tells me again quite well what's doing."
1420,P10_GMT20211130.odt,Task sequence complex,"Okay, what was the other question?"
1421,P10_GMT20211130.odt,Home tab elements useful,"I can't think of what else needs to be added but then again, I am coming from a background of knowing about this stuff."
1422,P10_GMT20211130.odt,Query inputs and elements useful,Sign in ... I think I typed that correctly ... okay
1429,P10_GMT20211130.odt,Query inputs and elements useful,Let's go with definite events in Galway.
1428,P10_GMT20211130.odt,Query inputs and elements useful,"Let's go with a shortish time window like 4 days. Although if this was vasculitis we would want a longer one, but that's alright."
1427,P10_GMT20211130.odt,Query process complex,"Time window lag, so this presumably means that I can go back to let's say."
1425,P10_GMT20211130.odt,Query inputs and elements useful,"Okay wait, time window length ... I might have a window length of a week and this presumably allows me to go back and say starting two weeks before the event."
1426,P10_GMT20211130.odt,Query process complex,"Now, what's not clear for me is whether the time window starts 14 days ago or starts 14+7 days ago. I will go with something in the middle here so now it will be three around three weeks ago but that's not entirely clear."
1424,P10_GMT20211130.odt,Query process clear,"Okay, I might as well click for data availability I think. Okay, 6 events and 4 data sets, that seems enough to me."
1430,P10_GMT20211130.odt,Query inputs and elements useful,You can tell me if I should have more events but that seems okay to me.
1431,P10_GMT20211130.odt,Query inputs and elements useful,And temporal units ... I think I will go with days just because I am not sure that the things that happen every hour matter much to this.
1432,P10_GMT20211130.odt,Query inputs and elements useful,And aggregation ... Mmmm ... we will go with mean.
1433,P10_GMT20211130.odt,Query process complex,I told you about the one that wasn't.
1434,P10_GMT20211130.odt,Additional explanation,Apart from that I think we are okay.
1434,P10_GMT20211130.odt,Query process complex,Apart from that I think we are okay.
1435,P10_GMT20211130.odt,Metadata content not useful or confusing,I don't remember choosing if I wanted weather or pollution but that's fine I didn't miss anything important.
1436,P10_GMT20211130.odt,Export (meta)data useful,"So that's okay, you have given me some weather and some pollution information ... humidity ..."
1437,P10_GMT20211130.odt,Metadata content clear and useful,"So the bit now I am wondering about is ... Oh yeah I see the events now: event-259, event-114 ... So these are 4 different people that had events happening to them. I am seeing three there. Ups what happened there. I am guessing that the other person is here ... Ups ... So why did I think there were 4 events, I must have missed that ... there is event-490 ... 2, 3, 4, 5, 6 (the participant is counting the events) ... Oh maybe I saw 6 events or maybe it was 6 events and 4 data sets. Okay, I am misremembering, my memory is poor. Okay I can understand what's going on here."
1438,P10_GMT20211130.odt,Task sequence complex,For each of the days we have ...
1439,P10_GMT20211130.odt,Moderator comment,"MODERATOR: If you don't mind this would be the next task, could you do task 4 first please?"
1441,P10_GMT20211130.odt,Metadata content clear and useful,"Data provenance, so where did this information come from in relation to 6 events."
1440,P10_GMT20211130.odt,Metadata content not useful or confusing,"We have these data sets with big large numbers that don't mean much to me, but I guess they relate to Met Eireann or environmental agencies of some sort."
1442,P10_GMT20211130.odt,Metadata content clear and useful,Okay that seems reasonable.
1443,P10_GMT20211130.odt,Navigation complex,"The information there is pretty much identical, is it?"
1445,P10_GMT20211130.odt,Task sequence complex,"Sorry, I will go back to the tasks for a second to make sure I am not doing anything stupid. (The participant reads the task again)"
1446,P10_GMT20211130.odt,Navigation complex,"To me they look the same, but okay ..."
1447,P10_GMT20211130.odt,Navigation complex,"Okay, so again it seems that the information is the same."
1448,P10_GMT20211130.odt,Navigation complex,"As far as I can see, these three things are giving me the same information but I might be missing something. Oh something happened there ... Okay I thought the first time when I was looking at data provenance it looked different ... Oh yes it did. There is something further down here that I am not seeing."
1455,P10_GMT20211130.odt,Metadata content not useful or confusing,"Okay, so this is the information about ... Well I don't know what this information is about ... Okay, so this information is about lots of more information about the data sets. Okay, I'm sure if you cared that would be interesting. The stuff on the bottom has different information."
1449,P10_GMT20211130.odt,Navigation complex,Scrolling around these little screens is not so easy and ... is there anything else?
1453,P10_GMT20211130.odt,Wording not clear,I'm not sure what data provenance and lineage
1454,P10_GMT20211130.odt,Metadata content not useful or confusing,"I'm not sure what data provenance and lineage is but there is a lot of information definitely in there, which seems to relate to locations."
1452,P10_GMT20211130.odt,Metadata content not useful or confusing,"I am not sure if I need to make some sense of it except it looks like location data. Okay I will go back here and I will assume I need to go further down. Okay, there is some other stuff regarding metadata of what everything came from."
1451,P10_GMT20211130.odt,Metadata content clear and useful,"For each event, previously you said that there were 4 in total."
1450,P10_GMT20211130.odt,Task sequence complex,(The participant reads the task again)
1456,P10_GMT20211130.odt,Navigation complex,"Go back, go back ... The provenance ... I do not know why this is not looking the same each time."
1457,P10_GMT20211130.odt,Metadata content clear and useful,"1, 2, 3, 4 ... (The participant counts the data sets used for all the events) Okay, I was a bit slow there."
1461,P10_GMT20211130.odt,Search information process complex,Okay so that presumably means I have to go through this stuff. I would love to search for it but I am not sure how this will work.
1458,P10_GMT20211130.odt,Moderator comment,MODERATOR: Do you mind reading the first paragraph again in the tab?
1463,P10_GMT20211130.odt,Task sequence complex,The first paragraph in the tab or the first here?
1462,P10_GMT20211130.odt,Task sequence complex,(The participant reads the task again)
1464,P10_GMT20211130.odt,Search information process complex,"Oh yeah, I was about to do that. So I put this here ... It is not finding it. Okay, whatever is going on here it is not looking in this window for what I am asking for. So the only copy of this that I am  finding is up there. So the simple answer is no, I cannot find the data use tab."
1459,P10_GMT20211130.odt,Moderator comment,MODERATOR: try again in the third text box
1465,P10_GMT20211130.odt,Navigation complex,"So the one I am in now, right? I think is probably a Firefox problem"
1460,P10_GMT20211130.odt,Moderator comment,"MODERATOR: No, you have three matches of your search"
1466,P10_GMT20211130.odt,Search information process complex,"Yeah, oh yeah. I tried that earlier and it did not work but it did work this time. This is because I am bad at browsing."
1467,P10_GMT20211130.odt,Search feature simple,"Data use okay this is the answer ... (The participant reads the data use comment) ... Okay that's the answer to that one, sorry very slow."
1468,P10_GMT20211130.odt,Search feature simple,"And the second thing, the identification risk comment ... Okay, I will be way quicker this time. Here it is ... (The participant reads the identification risk comment) ... I have been very slow but I am getting better."
1469,P10_GMT20211130.odt,Search feature simple,The license I guess is doing the same job here ... we will find out very soon ... creative commons license.
1470,P10_GMT20211130.odt,Additional explanation,"The date of the events, this one has no hovering but I worked out that it is the identification for the event."
1471,P10_GMT20211130.odt,Export (meta)data useful,(The participant reads the column name descriptions) I was able to do that.
1472,P10_GMT20211130.odt,Data table features useful,"I am going to assume that the read ones are out of the ordinary but let me have another look. It must say it somewhere ... Red ones are high and blue ones are low it says there ... I guess it is something to do with standard deviations or something. Yeah okay, I did understand that."
1475,P10_GMT20211130.odt,Data table features useful,"Yes, I guess I can do that. I really don't care about any pollution because there is nothing there so it's not that exciting."
1474,P10_GMT20211130.odt,Data table features useful,"I presumably can change the ordering of that, yeah. So now I have a weird order so I will go back to ordering it by event."
1476,P10_GMT20211130.odt,Export (meta)data useful,The question is if I do understand what I am seeing but again I do because I am coming to this with a lot of advantages knowing what we are trying to do. Like what the weather was for people who have some kind of event in the days leading to that event.
1477,P10_GMT20211130.odt,Export (meta)data useful,I am assuming that for each individual here I am getting ... (The participant counts the number of values per event) ... Okay so these are 8 days because I said I wanted days prior to this person's event. What I can tell then is that a person had an event on the 25th or 24th of July.
1478,P10_GMT20211130.odt,Additional feature suggestion,"I had long discussions about, well it is not relevant to your study but, whether we should be providing this information in this form, but I guess if I know nothing else except that event and I don't know anything else about the person. Then we are not giving away any secrets."
1479,P10_GMT20211130.odt,Data table features useful,"No, that's the task completed."
1480,P10_GMT20211130.odt,Navigation complex,"Okay let's look at this ... There is probably a way of getting rid of all of that up there but it's okay. Let me see if I can do that. No, I cannot deal with all of that. Once I've dealt with all of this it would be quite nice to get rid off all of this because it is a bit in my way. But okay, yeah okay, so ..."
1481,P10_GMT20211130.odt,Visualization useful,"So I am going to do a heat map of the rain Okay so here are my six events and my 8 days running up to the time of the event. Yeah I get that, these are the days and these are the events."
1482,P10_GMT20211130.odt,Visualization useful,"This seems to be a squashed version of this essentially, which would be good if there would be a lot of events."
1483,P10_GMT20211130.odt,Visualization useful,"I am afraid it does not tell me much of the use of the impact of the rain for these events, probably because the time length is too short. But anyway, that seems perfectly acceptable."
1484,P10_GMT20211130.odt,Visualization useful,"This is telling me that presumably in the 8 days leading up to the event-418 there was a very cold temperature ... but there is quite a variation in temperatures, which is typical of Ireland, isn't it? Well for the event-418 for the person event-418, whereas for the event-490 happens after a very narrow temperature variation. I don't think I need to say much more about that one."
1486,P10_GMT20211130.odt,Visualization useful,Uh lovely. Polar plots are good for wind direction and speed and I did not pick wind speed or wind direction so let me go back in a second.
1487,P10_GMT20211130.odt,Plot design complex,"Now that I remember what a polar plot is, okay. I don't see wind speed or direction there and that is probably because you have just done it."
1488,P10_GMT20211130.odt,Visualization useful,"So, what is this doing? I guess this is the total, 8 times 6 so 48 data wind speed and directions for the 8 days leading to the events. If you were not a statistician you might say that there is some pattern going on here but I guess that we are in Ireland and most of the weather comes from the west and south-west. The strongest winds come from the south and south-west and that is why none of these people had an event after a north-eastern wind because that is very rare. Yeah, helpful information if there was more data that would be useful, I guess."
1485,P10_GMT20211130.odt,Plot design complex,"Slightly relevant that the polar plot is only relevant if you have wind direction and speed, and I did not pick that up after I had picked up dew point temperature. But that's okay."
1489,P10_GMT20211130.odt,Additional feature suggestion,"Maybe trends but no, because we think that the environmental impact on weather is probably happening at the time, it could be because there was a change. So changes on these variables over a period of time but I am not an expert in this so I don't know how you would visualize that"
1491,P10_GMT20211130.odt,Query inputs and elements useful,Okay let's go for a different county
1492,P10_GMT20211130.odt,Query inputs and elements useful,let's have a longer time window
