id,document,tag,content
473,P2_GMT20211119.odt,Home tab elements useful,"Okay, I read this and I think the text is clear."
474,P2_GMT20211119.odt,Wording not clear,I am not exactly sure what all the images are for or whether they are there to help me.
475,P2_GMT20211119.odt,Home tab elements useful,I think that's everything I get that I get to be held to support to do my queries.
476,P2_GMT20211119.odt,Query inputs and elements useful,"Now, I am going to log in with the credentials provided. Okay, I am in."
477,P2_GMT20211119.odt,Query inputs and elements useful,I am going to select definite events for people in Ireland.
478,P2_GMT20211119.odt,Query inputs and elements useful,I am going to go for Dublin.
479,P2_GMT20211119.odt,Query inputs and elements useful,"Length of days, I am going to put in ... Time window length, so I am going to go for a seven day period."
480,P2_GMT20211119.odt,Query process complex,"Time window lag, so I think this means either side of that."
481,P2_GMT20211119.odt,Query process complex,"(The participant reads the temporal unit tool tip) I don't know what that is. Oh sorry, maybe that is at those temporal windows there."
482,P2_GMT20211119.odt,Query process complex,I am going to try to submit that but I am not doing something right.
483,P2_GMT20211119.odt,Query process clear,"No events, okay. I think I have ... Maybe if I change this."
484,P2_GMT20211119.odt,Query inputs and elements useful,"Let's see what I did there. Oh sorry, now I am getting this. Temporal units, I am gonna go by the day"
485,P2_GMT20211119.odt,Task sequence complex,So let me get back to my tasks. (The participant reads the task again)
486,P2_GMT20211119.odt,Query process complex,I was not sure whether I was inputting a query.
487,P2_GMT20211119.odt,Additional feature suggestion,"Maybe just something like enter a query, even though you have query inputs up there."
487,P2_GMT20211119.odt,Additional explanation,"Maybe just something like enter a query, even though you have query inputs up there."
488,P2_GMT20211119.odt,Export (meta)data useful,So this is my query and I was looking for definite events and here I have environmental information.
489,P2_GMT20211119.odt,Export (meta)data useful,(The participant reads the column heading descriptions from the data table)
489,P2_GMT20211119.odt,Task sequence complex,(The participant reads the column heading descriptions from the data table)
490,P2_GMT20211119.odt,Additional explanation,I am not sure what NOx means.
491,P2_GMT20211119.odt,Task sequence complex,(The participant reads the task again)
492,P2_GMT20211119.odt,Navigation complex,"When I was reading it, I was expecting that the data provenance, lineage, use and limitations would have a button for each. So that surprised me a bit. I want to explore them now."
493,P2_GMT20211119.odt,Task sequence complex,Each of the three buttons but I got five buttons.
494,P2_GMT20211119.odt,Metadata content clear and useful,"I am seeing example events Ireland, Wexford and 4 returns, so that is the provenance."
495,P2_GMT20211119.odt,Metadata content not useful or confusing,"I am getting this information here, which I am not sure what it means."
496,P2_GMT20211119.odt,Metadata content not useful or confusing,"Okay, here. So it is telling me where all the metadata is coming from I think."
497,P2_GMT20211119.odt,Navigation complex,"FAIR metadata export, I think I am not getting how this is all changing. Let me just go back."
498,P2_GMT20211119.odt,Navigation complex,"So that is the provenance, so when I close that it goes away. The same for the lineage and full metadata."
499,P2_GMT20211119.odt,Navigation complex,"I would have expected not to have all of them appear at the same time, but when I click another one the previous would disappear."
500,P2_GMT20211119.odt,Additional feature suggestion,Maybe also a button to show them all together.
501,P2_GMT20211119.odt,Simple export,"FAIR metadata export, I am getting a file coming down here."
502,P2_GMT20211119.odt,Navigation complex,I still have this text area showing. Let's see ...
503,P2_GMT20211119.odt,Task sequence complex,Let's see ... (The participant reads the sub task again)
504,P2_GMT20211119.odt,Metadata content clear and useful,"I think there was only one. Oh, no I better go back and take a look. How many data sets were used? Three data sets."
505,P2_GMT20211119.odt,Search feature simple,"Okay, the data license is there and it is a creative commons license."
506,P2_GMT20211119.odt,Metadata content not useful or confusing,The data use is just rdfs:comment. It is an rdfs about the data use but not telling me anything about it
510,P2_GMT20211119.odt,Search feature simple,"I have to ask about the identification, so this should be an interesting one. Where is my identification risk? Okay, so the information seems to be here but it may be better to have it summarized in a better particular way so that you can expand it in more detail. If I want to go further."
511,P2_GMT20211119.odt,Additional feature suggestion,"Okay, so the information seems to be here but it may be better to have it summarized in a better particular way so that you can expand it in more detail. If I want to go further."
509,P2_GMT20211119.odt,Search information process complex,"Okay, so I can't find the risk. MODERATOR: Do you want to try to use Control+F? Oh, you told me that. I am using Control+F but it is not doing anything. MODERATOR: Control+F opens a little box on the top and you can type what you want to look for? Okay, so risk."
572,P2_GMT20211119.odt,Moderator comment,MODERATOR: Do you want to try to use Control+F?
573,P2_GMT20211119.odt,Moderator comment,MODERATOR: Control+F opens a little box on the top and you can type what you want to look for?
512,P2_GMT20211119.odt,Search information process complex,So this has risk ... Data sets storage ... I am not getting an understanding of what the risk is. MODERATOR: Maybe you could use the arrows in the Control+F search box at the top right corner of your screen.
574,P2_GMT20211119.odt,Moderator comment,MODERATOR: Maybe you could use the arrows in the Control+F search box at the top right corner of your screen.
513,P2_GMT20211119.odt,Search information process complex,"Okay, now I got some description here now. It took me a while to find that. There is something there that is telling me. So my answer is that it could be just clearer or I could be faster."
514,P2_GMT20211119.odt,Navigation complex,"Now I am going to click on these extra buttons and I am going to get rid of that one, ups. I don't know why that happened."
515,P2_GMT20211119.odt,Export (meta)data useful,"So do I understand the columns? (The participant reads the column heading descriptions) So yes, they are clearly the ones I got there. If I am an expert in all of those things, I would know."
516,P2_GMT20211119.odt,Additional feature suggestion,"Maybe if I am an expert I would like to know more information, maybe ranges or something if that is relevant."
517,P2_GMT20211119.odt,Export (meta)data useful,"So yes, I guess I can find this information."
519,P2_GMT20211119.odt,Navigation complex,"So I am not told. Instinctively, I would say that the red ones are warnings or that they are higher of a particular range of something. The blue ones might be lower then."
518,P2_GMT20211119.odt,Additional feature suggestion,Maybe the range would have been nice to have up here if that is the case.
518,P2_GMT20211119.odt,Additional explanation,Maybe the range would have been nice to have up here if that is the case.
520,P2_GMT20211119.odt,Navigation complex,So we can hide them. I am not quite sure where the toggle columns button is but I can use the little eye to do that.
521,P2_GMT20211119.odt,Navigation complex,"I suppose ... but wait, how do I get the hidden columns back? I don't know if I have them all displayed now because I got rid of some of them."
522,P2_GMT20211119.odt,Navigation complex,Maybe I go and I do this. I am not sure how I am going to get them back or maybe they are all there because I don't remember. Oh no because I don't have the event column.
523,P2_GMT20211119.odt,Data table features useful,"MODERATOR: Maybe try the toggle columns button. Oh, very good. Now I found it. Okay, so I am making them disappear, not making them appear. Okay I got all the columns now. Okay, so that is obvious to me now and that is a handy feature."
523,P2_GMT20211119.odt,Navigation complex,"MODERATOR: Maybe try the toggle columns button. Oh, very good. Now I found it. Okay, so I am making them disappear, not making them appear. Okay I got all the columns now. Okay, so that is obvious to me now and that is a handy feature."
575,P2_GMT20211119.odt,Moderator comment,MODERATOR: Maybe try the toggle columns button.
526,P2_GMT20211119.odt,Wording not clear,I didn't notice these up here. I don't remember seeing that before
525,P2_GMT20211119.odt,Data table features useful,"(The participant reads the data background paragraph). Okay, so the red are high and the blue are low, so what I expected them to be."
527,P2_GMT20211119.odt,Export (meta)data useful,"So now, Can I make sense now? is my question. So I have an event with a particular name and I have all of this data here. I am understanding that on this particular day this event occurred and these are all the environmental factors that happened there. These are now all linked together from different data sets."
530,P2_GMT20211119.odt,Metadata content not useful or confusing,I did have three data sets but I am not sure which environmental variable comes from which data sets but I know that they are linked.
528,P2_GMT20211119.odt,Additional feature suggestion,"So, maybe the data set that it came from might be a useful thing to know. I don't know how you can mark them but that would be something useful."
529,P2_GMT20211119.odt,Navigation complex,"Maybe, these ones being red, I don't know about the significance of them being red but maybe that is up to the user to interpret that. I can see that these are red for the data set for that column and that event. But what does it mean for the event? is the whole row affected or is there a way of signaling that row instead of just the cell?"
532,P2_GMT20211119.odt,Visualization useful,This data table with all of these events that occurred on the previous slide. Now I am hearing relative time from the event (day). Relative for the event (day) ... Relative time from the event day -2 and event-530 and the range is there.
531,P2_GMT20211119.odt,Event concept and approach not clear,"So again, if there was a high and maybe this would come across, but it would be nice to see why I am getting these events or maybe it is all that it exists."
534,P2_GMT20211119.odt,Visualization useful,"I am going to pick rain. Okay so I just got four events here and I had four events there. Then, I have four events there. So there are four events."
533,P2_GMT20211119.odt,Navigation complex,So the events are in different orders in all of the screens.
535,P2_GMT20211119.odt,Plot design complex,I am not sure what these types of things are used for.
536,P2_GMT20211119.odt,Plot design complex,I am not sure if the events are supposed to be associated with this or this are just for the time range that I am in.
537,P2_GMT20211119.odt,Task sequence complex,It is loading up and I am going to read the tasks again. (The participant reads the task again)
538,P2_GMT20211119.odt,Additional feature suggestion,"I wonder if it would be nice that you could look at a collective of the three of them together maybe for 1 event if that was useful. For example, if you were to choose event-58, you could get three plots together for that event. I think I would like to add on this as well what the data sets were that contributed to this."
539,P2_GMT20211119.odt,Additional feature suggestion,So I think that the data sets would be interesting to see and maybe something about the color coding on what the different things mean. I would say you would get used to it quite quickly with all the different symbols once you started using it.
539,P2_GMT20211119.odt,Additional explanation,So I think that the data sets would be interesting to see and maybe something about the color coding on what the different things mean. I would say you would get used to it quite quickly with all the different symbols once you started using it.
540,P2_GMT20211119.odt,Overall positive experience,"Back to it now, so I am used to this by now."
542,P2_GMT20211119.odt,Query inputs and elements useful,I will input a new query for Ireland but this time I am going to look at no events.
548,P2_GMT20211119.odt,Query inputs and elements useful,I will go for 2 days and I got that ...
543,P2_GMT20211119.odt,Query process complex,"Okay, so I have 23 data sets here ... Oh sorry, no data available."
544,P2_GMT20211119.odt,Query process complex,So I am going to add Mayo in the locations. I am not getting any data ... Oh because I already got definite up there.
541,P2_GMT20211119.odt,Query process complex,Okay so the events I am looking for are no events in all of these places ... Why am I not getting to input the temporal unit?
545,P2_GMT20211119.odt,Query process complex,"Oh sorry, that is just telling me there. I was getting confused between two things here and the two things there."
546,P2_GMT20211119.odt,Query process complex,"This is just giving me information I think. So I have 20 and I don't need all of them, let's remove ... Okay, it is still saying that. I am going to submit this ... Mmmm. MODERATOR: Maybe try clicking data availability. Oh yes, that is right, very good. So Now I get the temporal unit and the aggregation method."
578,P2_GMT20211119.odt,Moderator comment,MODERATOR: Maybe try clicking data availability.
547,P2_GMT20211119.odt,Query inputs and elements useful,So I am going for days and mean again.
549,P2_GMT20211119.odt,Metadata content clear and useful,So the last one I got 3 data sets and I have 3 data sets now. The data sets are all the same for all of the events. It looks like there are 3 data sets again for all of those events.
2321,P2_GMT20211119.odt,Navigation complex,So the last one was created commons. So I need to get rid of data provenance and then go to this button. I should then have a window here to search for the license.
2322,P2_GMT20211119.odt,Search information process complex,Ups ... How do you spell license? Okay I am struggling now where this license is but I am determined.
577,P2_GMT20211119.odt,Moderator comment,MODERATOR: Maybe you can read one of the previous tasks to find out were the license was the first time.
2323,P2_GMT20211119.odt,Search information process complex,Maybe I just say that I cannot find it.
2324,P2_GMT20211119.odt,Navigation complex,"Okay, so that was in the full metadata exploration."
551,P2_GMT20211119.odt,Search feature simple,I can see that this is creative commons. So I did not read the other one properly but I do know it was creative commons but I can't remember the type of creative commons license because I didn't pay attention there. I only read the creative commons piece.
552,P2_GMT20211119.odt,Data table features useful,I think Q2 might have more but again I did not pay attention to that but I think I can find that out easily.
553,P2_GMT20211119.odt,Additional feature suggestion,"It might be interesting to see about those types of things, like the license, to have a little icon to say things like what is the license, the identification use. You know like a little symbol on it. That would be better than having to go in and look."
555,P2_GMT20211119.odt,Visualization useful,I am going to look at the heat map and select rain again. So I have got more events in this than I had in the other one. I am not really sure of what the differences are in terms of the data. I am not thinking of the data when trying to compare as it is not my area of information. I did not pick up a pattern in the last one. I can compare here.
556,P2_GMT20211119.odt,Additional feature suggestion,"I wonder because you are asking me about comparing queries, I wonder if it would have been nice to see more than one query on at the same time."
557,P2_GMT20211119.odt,Additional feature suggestion,If that is something that is ... I suppose that then you would have to have many information about the different queries even though we are here. We would probably have to show them on the right hand side as well.
558,P2_GMT20211119.odt,Task sequence complex,I think I did that already but I can go back to the first query and have a look at it.
559,P2_GMT20211119.odt,Simple export,Okay so I did that.
560,P2_GMT20211119.odt,Navigation complex,"How do I open this now? Okay, so I can see it there."
576,P2_GMT20211119.odt,Moderator comment,"MODERATOR: No problem, you can go ahead, no need to explore that."
561,P2_GMT20211119.odt,Simple export,I think I also did that.
562,P2_GMT20211119.odt,Additional explanation,I am not sure what I am getting when downloading it all. Is it just for this particular query or it is just for the two queries I did? So maybe add something that tells me which query I am downloading.
563,P2_GMT20211119.odt,Export (meta)data useful,"Yes, I think the way it is formatted with the export I can see that it is in a format it would be useful to input. There are a lot of details in there that would be useful in there that would be useful to input into another research."
565,P2_GMT20211119.odt,Overall positive experience,"Okay, so I don't think I got stuck too badly."
564,P2_GMT20211119.odt,Navigation complex,I am just looking at the screen here and I didn't pick up that the Q1 and Q2 were there. I could have flicked between the two queries. I wasn't aware that this was available to me.
566,P2_GMT20211119.odt,Overall positive experience,"Overall, I don't think I got stuck too badly on the first go with content I wouldn't be extremely familiar with. I mean I know about the concept but I am not used to the data or type of plots that would be use. I think this dashboard would be a type of user interface I could get used to."
567,P2_GMT20211119.odt,Overall positive experience,"It was quite quick and I was able to ... Once I found the buttons, I got used to using the buttons and I think I will be able to navigate it quite quickly."
568,P2_GMT20211119.odt,Additional feature suggestion,The only comment then would be in terms of icons on tables or maybe doing a combination of things but that is up to the researchers what they actually would find useful in combining.
569,P2_GMT20211119.odt,Additional feature suggestion,"Maybe more visibility around the characteristics of each plot or the data sets in terms of putting icons around the provenance or identification risk or something like that, as well as being able to find it. Just some summary, so as long as the summary was able to capture all of the nuances of the information behind. You don't want to give somebody a false sense of security if something is of low risk if it isn't. I know all that has to be taken into account."
570,P2_GMT20211119.odt,Overall positive experience,"Overall, I think the right hand side was very useful, even though I missed some things, which I did not know why I missed them."
571,P2_GMT20211119.odt,Query process complex,The left hand side I think I was getting a bit confused on the order to do the things in. Whether I had to check this data availability or when I could submit etcetera. That one maybe would be the one you would not get used to. Maybe there is a sequence that is out of place there.
579,P3_GMT20211125.odt,Home tab elements useful,I am going to check what a knowledge graph is. I don't know if you can see my screen but I have to log in here as well. I think with the same credentials as before. I will check that later.
580,P3_GMT20211125.odt,Home tab elements useful,"Okay, this all makes sense to me."
581,P3_GMT20211125.odt,Home tab elements useful,I think I could understand all that is here
582,P3_GMT20211125.odt,Home tab elements useful,"I am not going to say ask completed because I want to look at these links. Knowledge graph, this is graph db ... It takes a while ... loading loading."
583,P3_GMT20211125.odt,System issue,It takes a while ... loading loading.
584,P3_GMT20211125.odt,Home tab elements useful,"I will check the methodology, ah the GitHub okay."
585,P3_GMT20211125.odt,Home tab elements useful,I don't know if the graph db page is working but it is taking a while.
587,P3_GMT20211125.odt,Wording not clear,I guess what I was expecting when clicking on here was a description of what a knowledge graph is exactly. I am not sure I will find it here for what it says here.
587,P3_GMT20211125.odt,Additional explanation,I guess what I was expecting when clicking on here was a description of what a knowledge graph is exactly. I am not sure I will find it here for what it says here.
588,P3_GMT20211125.odt,System issue,"Yeah, this is still loading and we will get stuck here for a while."
589,P3_GMT20211125.odt,Home tab elements useful,I will try to log in into graph db again otherwise I will skip.
590,P3_GMT20211125.odt,Moderator comment,"MODERATOR: It is weird because for me it is working, feel free to go ahead with the tasks."
591,P3_GMT20211125.odt,System issue,"Okay, it was loading for a while."
592,P3_GMT20211125.odt,Home tab elements useful,"I think the information was enough especially to understand how this can be useful to people you want to, you know, get hold of this data, explore it somehow and search for that."
593,P3_GMT20211125.odt,Wording not clear,"Not much, I had a bit of a doubt what a knowledge graph is exactly and that is why I clicked there. Maybe adding an explanation or a link to a place, I mean you don't need to write it here."
593,P3_GMT20211125.odt,Additional explanation,"Not much, I had a bit of a doubt what a knowledge graph is exactly and that is why I clicked there. Maybe adding an explanation or a link to a place, I mean you don't need to write it here."
594,P3_GMT20211125.odt,Query inputs and elements useful,"Okay, this is what I did before on another website. Okay, super fast."
595,P3_GMT20211125.odt,Query inputs and elements useful,"Mmmm ... Interesting ... I guess the definite events are confirmed cases of something, example events, like a disease let's say. These events are not biologically confirmed but suspected somehow. These events are discarded. I am a weird person and I am going to choose the no, those that probably had a clinical form similar to what you would expect for this disease but then it was a no and it is something else."
596,P3_GMT20211125.odt,Query process complex,I am not very familiar with Ireland so I am going to go with Cork in the south.
598,P3_GMT20211125.odt,Query inputs and elements useful,Time window length (days) ... I guess it is the window of days that I want the data.
597,P3_GMT20211125.odt,Query inputs and elements useful,I guess the lag is the lag of the data with respect to the clinical data ... I am not going to put a lot of lag.
599,P3_GMT20211125.odt,Query process clear,Temporal unit ... I have to first check if the data is available.
600,P3_GMT20211125.odt,Query inputs and elements useful,"Ah okay, now I have to choose this temporal unit. (The participant reads the temporal unit tool tip)"
601,P3_GMT20211125.odt,Query process clear,"Okay, so this is an aggregation process that goes internally."
602,P3_GMT20211125.odt,Query process complex,"The aggregation method, this is hard to let the user choose this, maybe. Depends on the variable I guess. Interesting. I am going to put ... For me it is a bit confusing as I would like to know what sort of variables I am going to be selecting because I don't know."
603,P3_GMT20211125.odt,Query inputs and elements useful,I am going to select the mean as it makes general sense.
604,P3_GMT20211125.odt,System issue,"Okay, the Q1 ... Where is the Q1 tab? I think I submitted this. Okay, it is taking a while. MODERATOR: I got a critical error from the hosting platform. Could you try to refresh the dashboard and re-submit a query? Could you also try a different location? Okay, I will try for Dublin. Okay, so 20 days with a 5 days lag. Data is available. Ah okay, it is fine."
605,P3_GMT20211125.odt,Moderator comment,MODERATOR: I got a critical error from the hosting platform. Could you try to refresh the dashboard and re-submit a query? Could you also try a different location?
606,P3_GMT20211125.odt,Wording not clear,Yeah this is the Q1 tab. I wonder what Q1 means. Is it like query 1? Okay.
607,P3_GMT20211125.odt,Query inputs and elements useful,"I guess if I do queries, I will have other tabs here."
609,P3_GMT20211125.odt,Metadata content clear and useful,"Okay, so if I go here ... Event type no, yeah as I have chosen the no. This is the query I guess. The data sets used are here, which should have the same dates and the lag I guess."
610,P3_GMT20211125.odt,Metadata content not useful or confusing,"I put the lag of 5 days, but it says 2021-10-12 and it goes from ... Ah no it is the same file. It changes only this EEA-28A ... Okay."
611,P3_GMT20211125.odt,Task sequence complex,(The participant reads the sub tasks again)
613,P3_GMT20211125.odt,Metadata content not useful or confusing,"This is the data provenance and these are the data sets where information comes from, but I do not have a clear idea of what they mean. They all have the same date which is a bit weird to me."
614,P3_GMT20211125.odt,Metadata content not useful or confusing,"Data lineage ... I guess it is this here. This was the provenance and the data lineage is like code. Probably, it is what is going behind it, like the exact ..."
615,P3_GMT20211125.odt,Wording not clear,"This is called data lineage, maybe the name is a bit confusing as I don't know what the lineage is exactly."
